#node,Magenta Annotation
PDHX,"Pyruvate dehydrogenase protein X component, mitochondrial; Required for anchoring dihydrolipoamide dehydrogenase (E3) to the dihydrolipoamide transacetylase (E2) core of the pyruvate dehydrogenase complexes of eukaryotes. This specific binding is essential for a functional PDH complex"
PGD,"6-phosphogluconate dehydrogenase, decarboxylating; Catalyzes the oxidative decarboxylation of 6- phosphogluconate to ribulose 5-phosphate and CO(2), with concomitant reduction of NADP to NADPH; Belongs to the 6-phosphogluconate dehydrogenase family"
PHF14,PHD finger protein 14
PIGW,"Phosphatidylinositol-glycan biosynthesis class W protein; Required for the transport of GPI-anchored proteins to the plasma membrane. Probable acetyltransferase, which acetylates the inositol ring of phosphatidylinositol during biosynthesis of GPI-anchor. Acetylation during GPI-anchor biosynthesis is not essential for the subsequent mannosylation and is usually removed soon after the attachment of GPIs to proteins (By similarity); Belongs to the PIGW family"
PKMYT1,"Membrane-associated tyrosine- and threonine-specific cdc2-inhibitory kinase; Acts as a negative regulator of entry into mitosis (G2 to M transition) by phosphorylation of the CDK1 kinase specifically when CDK1 is complexed to cyclins. Mediates phosphorylation of CDK1 predominantly on 'Thr-14'. Also involved in Golgi fragmentation. May be involved in phosphorylation of CDK1 on 'Tyr-15' to a lesser degree, however tyrosine kinase activity is unclear and may be indirect. May be a downstream target of Notch signaling pathway during eye development; Protein phosphatase 1 regulatory subunits"
PLK1,"Serine/threonine-protein kinase PLK1; Serine/threonine-protein kinase that performs several important functions throughout M phase of the cell cycle, including the regulation of centrosome maturation and spindle assembly, the removal of cohesins from chromosome arms, the inactivation of anaphase-promoting complex/cyclosome (APC/C) inhibitors, and the regulation of mitotic exit and cytokinesis. Polo-like kinase proteins acts by binding and phosphorylating proteins are that already phosphorylated on a specific motif recognized by the POLO box domains. Phosphorylates BORA, BUB1B/BUBR1, CC [...] "
PLK4,"Serine/threonine-protein kinase PLK4; Serine/threonine-protein kinase that plays a central role in centriole duplication. Able to trigger procentriole formation on the surface of the parental centriole cylinder, leading to the recruitment of centriole biogenesis proteins such as SASS6, CENPJ/CPAP, CCP110, CEP135 and gamma-tubulin. When overexpressed, it is able to induce centrosome amplification through the simultaneous generation of multiple procentrioles adjoining each parental centriole during S phase. Phosphorylates 'Ser-151' of FBXW5 during the G1/S transition, leading to inhibit  [...] "
PNPT1,"Polyribonucleotide nucleotidyltransferase 1, mitochondrial; RNA-binding protein implicated in numerous RNA metabolic processes. Catalyzes the phosphorolysis of single-stranded polyribonucleotides processively in the 3'-to-5' direction. Mitochondrial intermembrane factor with RNA-processing exoribonulease activity. Component of the mitochondrial degradosome (mtEXO) complex, that degrades 3' overhang double- stranded RNA with a 3'-to-5' directionality in an ATP-dependent manner. Required for correct processing and polyadenylation of mitochondrial mRNAs. Plays a role as a cytoplasmic RNA  [...] "
POC1A,"POC1 centriolar protein homolog A; Plays an important role in centriole assembly and/or stability and ciliogenesis. Involved in early steps of centriole duplication, as well as in the later steps of centriole length control. Acts in concert with POC1B to ensure centriole integrity and proper mitotic spindle formation; Belongs to the WD repeat POC1 family"
POLA2,DNA polymerase alpha subunit B; May play an essential role at the early stage of chromosomal DNA replication by coupling the polymerase alpha/primase complex to the cellular replication machinery
POLE2,DNA polymerase epsilon subunit 2; Participates in DNA repair and in chromosomal DNA replication
POLQ,"DNA polymerase theta; DNA polymerase that promotes microhomology-mediated end- joining (MMEJ), an alternative non-homologous end-joining (NHEJ) machinery triggered in response to double-strand breaks in DNA. MMEJ is an error-prone repair pathway that produces deletions of sequences from the strand being repaired and promotes genomic rearrangements, such as telomere fusions, some of them leading to cellular transformation. POLQ acts as an inhibitor of homology-recombination repair (HR) pathway by limiting RAD51 accumulation at resected ends. POLQ-mediated MMEJ may be required to promote [...] "
POP1,"Ribonucleases P/MRP protein subunit POP1; Component of ribonuclease P, a protein complex that generates mature tRNA molecules by cleaving their 5'-ends. Also a component of RNase MRP"
PPA2,"Inorganic pyrophosphatase 2, mitochondrial; Hydrolyzes inorganic pyrophosphate. This activity is essential for correct regulation of mitochondrial membrane potential, and mitochondrial organization and function"
PPP1R8,Nuclear inhibitor of protein phosphatase 1; Inhibitor subunit of the major nuclear protein phosphatase-1 (PP-1). It has RNA-binding activity but does not cleave RNA and may target PP-1 to RNA-associated substrates. May also be involved in pre-mRNA splicing. Binds DNA and might act as a transcriptional repressor. Seems to be required for cell proliferation
PRC1,"Protein regulator of cytokinesis 1; Key regulator of cytokinesis that cross-links antiparrallel microtubules at an average distance of 35 nM. Essential for controlling the spatiotemporal formation of the midzone and successful cytokinesis. Required for KIF14 localization to the central spindle and midbody. Required to recruit PLK1 to the spindle. Stimulates PLK1 phosphorylation of RACGAP1 to allow recruitment of ECT2 to the central spindle. Acts as an oncogene for promoting bladder cancer cells proliferation, apoptosis inhibition and carcinogenic progression; Belongs to the MAP65/ASE1 family"
PRKAG1,"5'-AMP-activated protein kinase subunit gamma-1; AMP/ATP-binding subunit of AMP-activated protein kinase (AMPK), an energy sensor protein kinase that plays a key role in regulating cellular energy metabolism. In response to reduction of intracellular ATP levels, AMPK activates energy-producing pathways and inhibits energy-consuming processes: inhibits protein, carbohydrate and lipid biosynthesis, as well as cell growth and proliferation. AMPK acts via direct phosphorylation of metabolic enzymes, and by longer-term effects via phosphorylation of transcription regulators. Also acts as a  [...] "
PRR16,"Protein Largen; Regulator of cell size that promotes cell size increase independently of mTOR and Hippo signaling pathways. Acts by stimulating the translation of specific mRNAs, including those encoding proteins affecting mitochondrial functions. Increases mitochondrial mass and respiration"
PSMA1,"Proteasome subunit alpha type-1; Component of the 20S core proteasome complex involved in the proteolytic degradation of most intracellular proteins. This complex plays numerous essential roles within the cell by associating with different regulatory particles. Associated with two 19S regulatory particles, forms the 26S proteasome and thus participates in the ATP-dependent degradation of ubiquitinated proteins. The 26S proteasome plays a key role in the maintenance of protein homeostasis by removing misfolded or damaged proteins that could impair cellular functions, and by removing pro [...] "
PSMC2,"26S proteasome regulatory subunit 7; Component of the 26S proteasome, a multiprotein complex involved in the ATP-dependent degradation of ubiquitinated proteins. This complex plays a key role in the maintenance of protein homeostasis by removing misfolded or damaged proteins, which could impair cellular functions, and by removing proteins whose functions are no longer required. Therefore, the proteasome participates in numerous cellular processes, including cell cycle progression, apoptosis, or DNA damage repair. PSMC2 belongs to the heterohexameric ring of AAA (ATPases associated with [...] "
PSMD10,"26S proteasome non-ATPase regulatory subunit 10; Acts as a chaperone during the assembly of the 26S proteasome, specifically of the PA700/19S regulatory complex (RC). In the initial step of the base subcomplex assembly is part of an intermediate PSMD10:PSMC4:PSMC5:PAAF1 module which probably assembles with a PSMD5:PSMC2:PSMC1:PSMD2 module. Independently of the proteasome, regulates EGF-induced AKT activation through inhibition of the RHOA/ROCK/PTEN pathway, leading to prolonged AKT activation. Plays an important role in RAS-induced tumorigenesis; Ankyrin repeat domain containing"
PSMD12,"26S proteasome non-ATPase regulatory subunit 12; Component of the 26S proteasome, a multiprotein complex involved in the ATP-dependent degradation of ubiquitinated proteins. This complex plays a key role in the maintenance of protein homeostasis by removing misfolded or damaged proteins, which could impair cellular functions, and by removing proteins whose functions are no longer required. Therefore, the proteasome participates in numerous cellular processes, including cell cycle progression, apoptosis, or DNA damage repair; Belongs to the proteasome subunit p55 family"
PSMD14,"26S proteasome non-ATPase regulatory subunit 14; Component of the 26S proteasome, a multiprotein complex involved in the ATP-dependent degradation of ubiquitinated proteins. This complex plays a key role in the maintenance of protein homeostasis by removing misfolded or damaged proteins, which could impair cellular functions, and by removing proteins whose functions are no longer required. Therefore, the proteasome participates in numerous cellular processes, including cell cycle progression, apoptosis, or DNA damage repair. The PSMD14 subunit is a metalloprotease that specifically cle [...] "
PSMD6,"Proteasome 26S subunit, non-ATPase 6"
PSRC1,"Proline/serine-rich coiled-coil protein 1; Required for normal progression through mitosis. Required for normal congress of chromosomes at the metaphase plate, and for normal rate of chromosomal segregation during anaphase. Plays a role in the regulation of mitotic spindle dynamics. Increases the rate of turnover of microtubules on metaphase spindles, and contributes to the generation of normal tension across sister kinetochores. Recruits KIF2A and ANKRD53 to the mitotic spindle and spindle poles. May participate in p53/TP53-regulated growth suppression; Belongs to the PSRC1 family"
PTBP1,Polypyrimidine tract-binding protein 1; Plays a role in pre-mRNA splicing and in the regulation of alternative splicing events. Activates exon skipping of its own pre-mRNA during muscle cell differentiation. Binds to the polypyrimidine tract of introns. May promote RNA looping when bound to two separate polypyrimidine tracts in the same pre-mRNA. May promote the binding of U2 snRNP to pre-mRNA. Cooperates with RAVER1 to modulate switching between mutually exclusive exons during maturation of the TPM1 pre-mRNA. Represses the splicing of MAPT/Tau exon 10. In case of infection by picornav [...] 
PTCD3,"Pentatricopeptide repeat domain-containing protein 3, mitochondrial; Mitochondrial RNA-binding protein that has a role in mitochondrial translation"
PTDSS1,"Phosphatidylserine synthase 1; Catalyzes a base-exchange reaction in which the polar head group of phosphatidylethanolamine (PE) or phosphatidylcholine (PC) is replaced by L-serine. In membranes, PTDSS1 catalyzes mainly the conversion of phosphatidylcholine. Also converts, in vitro and to a lesser extent, phosphatidylethanolamine"
PTGES3,"Prostaglandin E synthase 3; Cytosolic prostaglandin synthase that catalyzes the oxidoreduction of prostaglandin endoperoxide H2 (PGH2) to prostaglandin E2 (PGE2). Molecular chaperone that localizes to genomic response elements in a hormone-dependent manner and disrupts receptor-mediated transcriptional activation, by promoting disassembly of transcriptional regulatory complexes. Facilitates HIF alpha proteins hydroxylation via interaction with EGLN1/PHD2, leading to recruit EGLN1/PHD2 to the HSP90 pathway"
PTTG1,"Securin; Regulatory protein, which plays a central role in chromosome stability, in the p53/TP53 pathway, and DNA repair. Probably acts by blocking the action of key proteins. During the mitosis, it blocks Separase/ESPL1 function, preventing the proteolysis of the cohesin complex and the subsequent segregation of the chromosomes. At the onset of anaphase, it is ubiquitinated, conducting to its destruction and to the liberation of ESPL1. Its function is however not limited to a blocking activity, since it is required to activate ESPL1. Negatively regulates the transcriptional activity a [...] "
PUS7,Pseudouridylate synthase 7
PWP1,Periodic tryptophan protein 1 homolog; May play an important role in cell growth and/or transcription; Belongs to the WD repeat PWP1 family
PWP2,"Periodic tryptophan protein 2 homolog; PWP2, small subunit processome component; UTPb subcomplex"
QSOX2,Sulfhydryl oxidase 2; Catalyzes the oxidation of sulfhydryl groups in peptide and protein thiols to disulfides with the reduction of oxygen to hydrogen peroxide. May contribute to disulfide bond formation in a variety of secreted proteins. Also seems to play a role in regulating the sensitization of neuroblastoma cells for interferon-gamma-induced apoptosis
RAB6B,Ras-related protein Rab-6B; Seems to have a role in retrograde membrane traffic at the level of the Golgi complex. May function in retrograde transport in neuronal cells; Belongs to the small GTPase superfamily. Rab family
RABIF,"Guanine nucleotide exchange factor MSS4; Guanine-nucleotide-releasing protein that acts on members of the SEC4/YPT1/RAB subfamily. Stimulates GDP release from both YPT1 and RAB3A, but is less active on these proteins than on the SEC4 protein. Might play a general role in vesicular transport; Belongs to the DSS4/MSS4 family"
RACGAP1,Rac GTPase-activating protein 1; Component of the centralspindlin complex that serves as a microtubule-dependent and Rho-mediated signaling required for the myosin contractile ring formation during the cell cycle cytokinesis. Required for proper attachment of the midbody to the cell membrane during cytokinesis. Plays key roles in controlling cell growth and differentiation of hematopoietic cells through mechanisms other than regulating Rac GTPase activity. Also involved in the regulation of growth-related processes in adipocytes and myoblasts. May be involved in regulating spermatogene [...] 
RAD1,Cell cycle checkpoint protein RAD1; Component of the 9-1-1 cell-cycle checkpoint response complex that plays a major role in DNA repair. The 9-1-1 complex is recruited to DNA lesion upon damage by the RAD17-replication factor C (RFC) clamp loader complex. Acts then as a sliding clamp platform on DNA for several proteins involved in long-patch base excision repair (LP-BER). The 9-1-1 complex stimulates DNA polymerase beta (POLB) activity by increasing its affinity for the 3'-OH end of the primer-template and stabilizes POLB to those sites where LP-BER proceeds; endonuclease FEN1 cleavag [...] 
RAD23B,UV excision repair protein RAD23 homolog B; Multiubiquitin chain receptor involved in modulation of proteasomal degradation. Binds to polyubiquitin chains. Proposed to be capable to bind simultaneously to the 26S proteasome and to polyubiquitinated substrates and to deliver ubiquitinated proteins to the proteasome. May play a role in endoplasmic reticulum- associated degradation (ERAD) of misfolded glycoproteins by association with PNGase and delivering deglycosylated proteins to the proteasome; Belongs to the RAD23 family
RAD51,DNA repair protein RAD51 homolog 1; Fanconi anemia complementation groups
RAD51AP1,"RAD51-associated protein 1; May participate in a common DNA damage response pathway associated with the activation of homologous recombination and double-strand break repair. Functionally cooperates with PALB2 in promoting of D-loop formation by RAD51. Binds to single and double stranded DNA, and is capable of aggregating DNA. Also binds RNA"
RAD54B,DNA repair and recombination protein RAD54B; Involved in DNA repair and mitotic recombination. May play an active role in recombination processes in concert with other members of the RAD52 epistasis group; Belongs to the SNF2/RAD54 helicase family
RAD54L,DNA repair and recombination protein RAD54-like; Involved in DNA repair and mitotic recombination. Functions in the recombinational DNA repair (RAD52) pathway. Dissociates RAD51 from nucleoprotein filaments formed on dsDNA. Could be involved in the turnover of RAD51 protein-dsDNA filaments (By similarity). May play also an essential role in telomere length maintenance and telomere capping in mammalian cells
RALA,"Ras-related protein Ral-A; Multifunctional GTPase involved in a variety of cellular processes including gene expression, cell migration, cell proliferation, oncogenic transformation and membrane trafficking. Accomplishes its multiple functions by interacting with distinct downstream effectors. Acts as a GTP sensor for GTP-dependent exocytosis of dense core vesicles. The RALA-exocyst complex regulates integrin-dependent membrane raft exocytosis and growth signaling. Key regulator of LPAR1 signaling and competes with GRK2 for binding to LPAR1 thus affecting the signaling properties of th [...] "
RAN,"GTP-binding nuclear protein Ran; GTPase involved in nucleocytoplasmic transport, participating both to the import and the export from the nucleus of proteins and RNAs. Switches between a cytoplasmic GDP- and a nuclear GTP-bound state by nucleotide exchange and GTP hydrolysis. Nuclear import receptors such as importin beta bind their substrates only in the absence of GTP-bound RAN and release them upon direct interaction with GTP-bound RAN while export receptors behave in the opposite way. Thereby, RAN controls cargo loading and release by transport receptors in the proper compartment a [...] "
RARS,"Arginine--tRNA ligase, cytoplasmic; Forms part of a macromolecular complex that catalyzes the attachment of specific amino acids to cognate tRNAs during protein synthesis. Modulates the secretion of AIMP1 and may be involved in generation of the inflammatory cytokine EMAP2 from AIMP1; Aminoacyl tRNA synthetases, Class I"
RBM28,RNA-binding protein 28; Nucleolar component of the spliceosomal ribonucleoprotein complexes; RNA binding motif containing
RBM45,RNA-binding protein 45; RNA-binding protein with binding specificity for poly(C). May play an important role in neural development
RCC1,"Regulator of chromosome condensation; Guanine-nucleotide releasing factor that promotes the exchange of Ran-bound GDP by GTP. Involved in the regulation of onset of chromosome condensation in the S phase. Binds both to the nucleosomes and double-stranded DNA. RCC1-Ran complex (together with other proteins) acts as a component of a signal transmission pathway that detects unreplicated DNA. Plays a key role in nucleo- cytoplasmic transport, mitosis and nuclear-envelope assembly"
RCC2,Protein RCC2; Required for completion of mitosis and cytokinesis. May function as a guanine nucleotide exchange factor for the small GTPase RAC1
RCL1,"RNA 3'-terminal phosphate cyclase-like protein; Does not have cyclase activity. Plays a role in 40S- ribosomal-subunit biogenesis in the early pre-rRNA processing steps at sites A0, A1 and A2 that are required for proper maturation of the 18S RNA (By similarity)"
RDM1,RAD52 motif-containing protein 1; May confer resistance to the antitumor agent cisplatin. Binds to DNA and RNA; RNA binding motif containing
REPIN1,"Replication initiator 1; Sequence-specific double-stranded DNA-binding protein required for initiation of chromosomal DNA replication. Binds on 5'-ATT-3' reiterated sequences downstream of the origin of bidirectional replication (OBR) and a second, homologous ATT sequence of opposite orientation situated within the OBR zone. Facilitates DNA bending; Zinc fingers C2H2-type"
RFC3,Replication factor C subunit 3; The elongation of primed DNA templates by DNA polymerase delta and epsilon requires the action of the accessory proteins proliferating cell nuclear antigen (PCNA) and activator 1; AAA ATPases
RFC4,Replication factor C subunit 4; The elongation of primed DNA templates by DNA polymerase delta and epsilon requires the action of the accessory proteins proliferating cell nuclear antigen (PCNA) and activator 1. This subunit may be involved in the elongation of the multiprimed DNA template
RFC5,Replication factor C subunit 5; The elongation of primed DNA templates by DNA polymerase delta and epsilon requires the action of the accessory proteins proliferating cell nuclear antigen (PCNA) and activator 1; AAA ATPases
RFX6,"DNA-binding protein RFX6; Transcription factor required to direct islet cell differentiation during endocrine pancreas development. Specifically required for the differentiation of 4 of the 5 islet cell types and for the production of insulin. Not required for pancreatic PP (polypeptide- producing) cells differentiation. Acts downstream of NEUROG3 and regulates the transcription factors involved in beta-cell maturation and function, thereby restricting the expression of the beta-cell differentiation and specification genes, and thus the beta-cell fate choice. Activates transcription by [...] "
RIOK1,Serine/threonine-protein kinase RIO1; Involved in the final steps of cytoplasmic maturation of the 40S ribosomal subunit. Involved in processing of 18S-E pre- rRNA to the mature 18S rRNA. Required for the recycling of NOB1 and PNO1 from the late 40S precursor. The association with the very late 40S subunit intermediate may involve a translation-like checkpoint point cycle preceeding the binding to the 60S ribosomal subunit (By similarity). Despite the protein kinase domain is proposed to act predominantly as an ATPase (By similarity). The catalytic activity regulates its dynamic associ [...] 
RIPPLY3,Protein ripply3; Acts as a transcriptional corepressor. Negative regulator of the transcriptional activity of TBX1. Plays a role in the development of the pharyngeal apparatus and derivatives (By similarity); Belongs to the ripply family
RMI2,"RecQ-mediated genome instability protein 2; Essential component of the RMI complex, a complex that plays an important role in the processing of homologous recombination intermediates. It is required to regulate sister chromatid segregation and to limit DNA crossover. Essential for the stability, localization, and function of BLM, TOP3A, and complexes containing BLM. In the RMI complex, it is required to target BLM to chromatin and stress-induced nuclear foci and mitotic phosphorylation of BLM"
RNASEH2A,"Ribonuclease H2 subunit A; Catalytic subunit of RNase HII, an endonuclease that specifically degrades the RNA of RNA:DNA hybrids. Participates in DNA replication, possibly by mediating the removal of lagging- strand Okazaki fragment RNA primers during DNA replication. Mediates the excision of single ribonucleotides from DNA:RNA duplexes; Belongs to the RNase HII family. Eukaryotic subfamily"
RPA3,"Replication protein A 14 kDa subunit; As part of the heterotrimeric replication protein A complex (RPA/RP-A), binds and stabilizes single-stranded DNA intermediates that form during DNA replication or upon DNA stress. It prevents their reannealing and in parallel, recruits and activates different proteins and complexes involved in DNA metabolism. Thereby, it plays an essential role both in DNA replication and the cellular response to DNA damage. In the cellular response to DNA damage, the RPA complex controls DNA repair and DNA damage checkpoint activation. Through recruitment of ATRIP [...] "
RPP40,"Ribonuclease P protein subunit p40; Component of ribonuclease P, a protein complex that generates mature tRNA molecules by cleaving their 5'-ends"
RRM1,Ribonucleoside-diphosphate reductase large subunit; Provides the precursors necessary for DNA synthesis. Catalyzes the biosynthesis of deoxyribonucleotides from the corresponding ribonucleotides
RRM2,Ribonucleoside-diphosphate reductase subunit M2; Provides the precursors necessary for DNA synthesis. Catalyzes the biosynthesis of deoxyribonucleotides from the corresponding ribonucleotides. Inhibits Wnt signaling; Belongs to the ribonucleoside diphosphate reductase small chain family
RUVBL1,RuvB-like 1; May be able to bind plasminogen at cell surface and enhance plasminogen activation; AAA ATPases
SAPCD2,Suppressor APC domain-containing protein 2; Plays a role in planar mitotic spindle orientation in retinal progenitor cells (RPCs) and promotes the production of symmetric terminal divisions (By similarity). Negatively regulates the mitotic apical cortex localization of GPSM2. Involved also in positive regulation of cell proliferation and tumor cell growth
SBK1,Serine/threonine-protein kinase SBK1; May be involved in signal-transduction pathways related to the control of brain development
SCLT1,"Sodium channel and clathrin linker 1; Adapter protein that links SCN10A to clathrin. Regulates SCN10A channel activity, possibly by promoting channel internalization (By similarity)"
