#node,Magenta Annotation
ABCF2,ATP binding cassette subfamily F member 2
ABRACL,Costars family protein ABRACL; ABRA C-terminal like; Belongs to the costars family
ACAT1,"Acetyl-CoA acetyltransferase, mitochondrial; Plays a major role in ketone body metabolism"
ACBD7,Acyl-CoA-binding domain-containing protein 7; Binds medium- and long-chain acyl-CoA esters
ACP1,Low molecular weight phosphotyrosine protein phosphatase; Class II Cys-based phosphatases
ACTL6A,"Actin-like protein 6A; Involved in transcriptional activation and repression of select genes by chromatin remodeling (alteration of DNA-nucleosome topology). Component of SWI/SNF chromatin remodeling complexes that carry out key enzymatic activities, changing chromatin structure by altering DNA-histone contacts within a nucleosome in an ATP-dependent manner. Required for maximal ATPase activity of SMARCA4/BRG1/BAF190A and for association of the SMARCA4/BRG1/BAF190A containing remodeling complex BAF with chromatin/nuclear matrix. Belongs to the neural progenitors- specific chromatin rem [...] "
ACTL8,Actin-like protein 8; Actin related proteins
ADK,Adenosine kinase; ATP dependent phosphorylation of adenosine and other related nucleoside analogs to monophosphate derivatives. Serves as a potential regulator of concentrations of extracellular adenosine and intracellular adenine nucleotides; Belongs to the carbohydrate kinase PfkB family
AFP,"Alpha-fetoprotein; Binds copper, nickel, and fatty acids as well as, and bilirubin less well than, serum albumin. Only a small percentage (less than 2%) of the human AFP shows estrogen-binding properties; Belongs to the ALB/AFP/VDB family"
AGK,"Acylglycerol kinase, mitochondrial; Lipid kinase that can phosphorylate both monoacylglycerol and diacylglycerol to form lysophosphatidic acid (LPA) and phosphatidic acid (PA), respectively. Does not phosphorylate sphingosine. Independently of its lipid kinase activity, acts as a component of the TIM22 complex. The TIM22 complex mediates the import and insertion of multi-pass transmembrane proteins into the mitochondrial inner membrane by forming a twin-pore translocase that uses the membrane potential as the external driving force. In the TIM22 complex, required for the import of a su [...] "
AIFM1,"Apoptosis-inducing factor 1, mitochondrial; Functions both as NADH oxidoreductase and as regulator of apoptosis. In response to apoptotic stimuli, it is released from the mitochondrion intermembrane space into the cytosol and to the nucleus, where it functions as a proapoptotic factor in a caspase-independent pathway. In contrast, functions as an antiapoptotic factor in normal mitochondria via its NADH oxidoreductase activity. The soluble form (AIFsol) found in the nucleus induces 'parthanatos' i.e. caspase-independent fragmentation of chromosomal DNA. Interacts with EIF3G,and thereby  [...] "
AIMP2,"Aminoacyl tRNA synthase complex-interacting multifunctional protein 2; Required for assembly and stability of the aminoacyl- tRNA synthase complex. Mediates ubiquitination and degradation of FUBP1, a transcriptional activator of MYC, leading to MYC down-regulation which is required for aveolar type II cell differentiation. Blocks MDM2-mediated ubiquitination and degradation of p53/TP53. Functions as a proapoptotic factor"
AKR1D1,"3-oxo-5-beta-steroid 4-dehydrogenase; Efficiently catalyzes the reduction of progesterone, androstenedione, 17-alpha-hydroxyprogesterone and testosterone to 5-beta-reduced metabolites. The bile acid intermediates 7- alpha,12-alpha-dihydroxy-4-cholesten-3-one and 7-alpha-hydroxy-4- cholesten-3-one can also act as substrates; Aldo-keto reductases"
ANLN,Anillin; Required for cytokinesis. Essential for the structural integrity of the cleavage furrow and for completion of cleavage furrow ingression. Plays a role in bleb assembly during metaphase and anaphase of mitosis. May play a significant role in podocyte cell migration; Pleckstrin homology domain containing
APOBEC3B,"DNA dC->dU-editing enzyme APOBEC-3B; DNA deaminase (cytidine deaminase) which acts as an inhibitor of retrovirus replication and retrotransposon mobility via deaminase-dependent and -independent mechanisms. After the penetration of retroviral nucleocapsids into target cells of infection and the initiation of reverse transcription, it can induce the conversion of cytosine to uracil in the minus-sense single-strand viral DNA, leading to G-to-A hypermutations in the subsequent plus-strand viral DNA. The resultant detrimental levels of mutations in the proviral genome, along with a deamina [...] "
ARHGAP11A,Rho GTPase activating protein 11A
ARHGDIG,"Rho GDP-dissociation inhibitor 3; Inhibits GDP/GTP exchange reaction of RhoB. Interacts specifically with the GDP- and GTP-bound forms of post- translationally processed Rhob and Rhog proteins, both of which show a growth-regulated expression in mammalian cells. Stimulates the release of the GDP-bound but not the GTP-bound RhoB protein. Also inhibits the GDP/GTP exchange of RhoB but shows less ability to inhibit the dissociation of prebound GTP"
ARHGEF26,"Rho guanine nucleotide exchange factor 26; Activates RhoG GTPase by promoting the exchange of GDP by GTP. Required for the formation of membrane ruffles during macropinocytosis. Required for the formation of cup-like structures during trans-endothelial migration of leukocytes. In case of Salmonella enterica infection, activated by SopB, which induces cytoskeleton rearrangements and promotes bacterial entry; Pleckstrin homology domain containing"
ARHGEF39,Rho guanine nucleotide exchange factor 39; Promotes cell proliferation
ARL6IP1,"ADP-ribosylation factor-like protein 6-interacting protein 1; Positively regulates SLC1A1/EAAC1-mediated glutamate transport by increasing its affinity for glutamate in a PKC activity-dependent manner. Promotes the catalytic efficiency of SLC1A1/EAAC1 probably by reducing its interaction with ARL6IP5, a negative regulator of SLC1A1/EAAC1-mediated glutamate transport (By similarity). Plays a role in the formation and stabilization of endoplasmic reticulum tubules. Negatively regulates apoptosis, possibly by modulating the activity of caspase-9 (CASP9). Inhibits cleavage of CASP9-depende [...] "
ARMC10,Armadillo repeat-containing protein 10; May play a role in cell survival and cell growth. May suppress the transcriptional activity of p53/TP53; Armadillo repeat containing
ASF1B,Histone chaperone ASF1B; Histone chaperone that facilitates histone deposition and histone exchange and removal during nucleosome assembly and disassembly. Cooperates with chromatin assembly factor 1 (CAF-1) to promote replication-dependent chromatin assembly. Does not participate in replication-independent nucleosome deposition which is mediated by ASF1A and HIRA. Required for spermatogenesis; Belongs to the ASF1 family
ASPM,"Abnormal spindle-like microcephaly-associated protein; Involved in mitotic spindle regulation and coordination of mitotic processes. The function in regulating microtubule dynamics at spindle poles including spindle orientation, astral microtubule density and poleward microtubule flux seems to depend on the association with the katanin complex formed by KATNA1 and KATNB1. Enhances the microtubule lattice severing activity of KATNA1 by recruiting the katanin complex to microtubules. Can block microtubule minus-end growth and reversely this function can be enhanced by the katanin complex [...] "
ASUN,"Integrator complex subunit 13; Crucial regulator of the mitotic cell cycle and development. At prophase, required for dynein anchoring to the nuclear envelope important for proper centrosome-nucleus coupling. At G2/M phase, may be required for proper spindle formation and execution of cytokinesis. Probable component of the Integrator (INT) complex, a complex involved in the small nuclear RNAs (snRNA) U1 and U2 transcription and in their 3'-box-dependent processing"
ATAD2,"ATPase family AAA domain-containing protein 2; May be a transcriptional coactivator of the nuclear receptor ESR1 required to induce the expression of a subset of estradiol target genes, such as CCND1, MYC and E2F1. May play a role in the recruitment or occupancy of CREBBP at some ESR1 target gene promoters. May be required for histone hyperacetylation. Involved in the estrogen-induced cell proliferation and cell cycle progression of breast cancer cells; Belongs to the AAA ATPase family"
ATG3,"Ubiquitin-like-conjugating enzyme ATG3; E2 conjugating enzyme required for the cytoplasm to vacuole transport (Cvt), autophagy, and mitochondrial homeostasis. Responsible for the E2-like covalent binding of phosphatidylethanolamine to the C-terminal Gly of ATG8-like proteins (GABARAP, GABARAPL1, GABARAPL2 or MAP1LC3A). The ATG12- ATG5 conjugate plays a role of an E3 and promotes the transfer of ATG8-like proteins from ATG3 to phosphatidylethanolamine (PE). This step is required for the membrane association of ATG8-like proteins. The formation of the ATG8-phosphatidylethanolamine conjug [...] "
ATP5B,"ATP synthase subunit beta, mitochondrial; Mitochondrial membrane ATP synthase (F(1)F(0) ATP synthase or Complex V) produces ATP from ADP in the presence of a proton gradient across the membrane which is generated by electron transport complexes of the respiratory chain. F-type ATPases consist of two structural domains, F(1) - containing the extramembraneous catalytic core, and F(0) - containing the membrane proton channel, linked together by a central stalk and a peripheral stalk. During catalysis, ATP synthesis in the catalytic domain of F(1) is coupled via a rotary mechanism of the c [...] "
AUNIP,"Aurora kinase A and ninein-interacting protein; DNA-binding protein that accumulates at DNA double- strand breaks (DSBs) following DNA damage and promotes DNA resection and homologous recombination. Serves as a sensor of DNA damage: binds DNA with a strong preference for DNA substrates that mimic structures generated at stalled replication forks, and anchors RBBP8/CtIP to DSB sites to promote DNA end resection and ensuing homologous recombination repair. Inhibits non-homologous end joining (NHEJ). Required for the dynamic movement of AURKA at the centrosomes and spindle apparatus durin [...] "
AURKA,"Aurora kinase A; Mitotic serine/threonine kinase that contributes to the regulation of cell cycle progression. Associates with the centrosome and the spindle microtubules during mitosis and plays a critical role in various mitotic events including the establishment of mitotic spindle, centrosome duplication, centrosome separation as well as maturation, chromosomal alignment, spindle assembly checkpoint, and cytokinesis. Required for initial activation of CDK1 at centrosomes. Phosphorylates numerous target proteins, including ARHGEF2, BORA, BRCA1, CDC25B, DLGP5, HDAC6, KIF2A, LATS2, NDE [...] "
AURKB,"Aurora kinase B; Serine/threonine-protein kinase component of the chromosomal passenger complex (CPC), a complex that acts as a key regulator of mitosis. The CPC complex has essential functions at the centromere in ensuring correct chromosome alignment and segregation and is required for chromatin-induced microtubule stabilization and spindle assembly. Involved in the bipolar attachment of spindle microtubules to kinetochores and is a key regulator for the onset of cytokinesis during mitosis. Required for central/midzone spindle assembly and cleavage furrow formation. Key component of  [...] "
B4GALT3,"Beta-1,4-galactosyltransferase 3; Responsible for the synthesis of complex-type N-linked oligosaccharides in many glycoproteins as well as the carbohydrate moieties of glycolipids; Beta 4-glycosyltransferases"
BFAR,"Bifunctional apoptosis regulator; Apoptosis regulator. Has anti-apoptotic activity, both for apoptosis triggered via death-receptors and via mitochondrial factors; Ring finger proteins"
BIRC5,Baculoviral IAP repeat containing 5
BLM,"Bloom syndrome protein; ATP-dependent DNA helicase that unwinds single- and double-stranded DNA in a 3'-5' direction. Participates in DNA replication and repair. Involved in 5'-end resection of DNA during double-strand break (DSB) repair: unwinds DNA and recruits DNA2 which mediates the cleavage of 5'-ssDNA. Negatively regulates sister chromatid exchange (SCE). Stimulates DNA 4-way junction branch migration and DNA Holliday junction dissolution. Binds single-stranded DNA (ssDNA), forked duplex DNA and DNA Holliday junction; RecQ like helicases"
BMP6,Bone morphogenetic protein 6; Induces cartilage and bone formation; Bone morphogenetic proteins
BRCA1,"Breast cancer type 1 susceptibility protein; E3 ubiquitin-protein ligase that specifically mediates the formation of 'Lys-6'-linked polyubiquitin chains and plays a central role in DNA repair by facilitating cellular responses to DNA damage. It is unclear whether it also mediates the formation of other types of polyubiquitin chains. The E3 ubiquitin-protein ligase activity is required for its tumor suppressor function. The BRCA1-BARD1 heterodimer coordinates a diverse range of cellular pathways such as DNA damage repair, ubiquitination and transcriptional regulation to maintain genomic [...] "
BTF3L4,Basic transcription factor 3 like 4; Belongs to the NAC-beta family
BUB1,"Mitotic checkpoint serine/threonine-protein kinase BUB1; Serine/threonine-protein kinase that performs 2 crucial functions during mitosis: it is essential for spindle-assembly checkpoint signaling and for correct chromosome alignment. Has a key role in the assembly of checkpoint proteins at the kinetochore, being required for the subsequent localization of CENPF, BUB1B, CENPE and MAD2L1. Required for the kinetochore localization of PLK1. Required for centromeric enrichment of AUKRB in prometaphase. Plays an important role in defining SGO1 localization and thereby affects sister chromat [...] "
BUB1B,"Mitotic checkpoint serine/threonine-protein kinase BUB1 beta; Essential component of the mitotic checkpoint. Required for normal mitosis progression. The mitotic checkpoint delays anaphase until all chromosomes are properly attached to the mitotic spindle. One of its checkpoint functions is to inhibit the activity of the anaphase-promoting complex/cyclosome (APC/C) by blocking the binding of CDC20 to APC/C, independently of its kinase activity. The other is to monitor kinetochore activities that depend on the kinetochore motor CENPE. Required for kinetochore localization of CENPE. Nega [...] "
C16orf59,Uncharacterized protein C16orf59; Chromosome 16 open reading frame 59
C16orf87,UPF0547 protein C16orf87; Chromosome 16 open reading frame 87; Belongs to the UPF0547 family
C17orf53,Uncharacterized protein C17orf53; Chromosome 17 open reading frame 53
C17orf75,Protein Njmu-R1; May have a role in spermatogenesis
C1orf112,Uncharacterized protein C1orf112; Chromosome 1 open reading frame 112
C1orf131,Uncharacterized protein C1orf131; Chromosome 1 open reading frame 131
C1orf43,Uncharacterized protein C1orf43; Chromosome 1 open reading frame 43
C2orf15,Uncharacterized protein C2orf15; Chromosome 2 open reading frame 15
C2orf47,"m-AAA protease-interacting protein 1, mitochondrial; Promotes sorting of SMDT1/EMRE in mitochondria by ensuring its maturation. Interacts with the transit peptide region of SMDT1/EMRE precursor protein in the mitochondrial matrix, leading to protect it against protein degradation by YME1L1, thereby ensuring SMDT1/EMRE maturation by the mitochondrial processing peptidase (PMPCA and PMPCB)"
C2orf48,Uncharacterized protein C2orf48; Chromosome 2 open reading frame 48
C3orf67,Uncharacterized protein C3orf67; Chromosome 3 open reading frame 67
C4orf46,Renal cancer differentiation gene 1 protein; Chromosome 4 open reading frame 46
C5orf30,UNC119-binding protein C5orf30; Probably plays a role in trafficking of proteins via its interaction with UNC119 and UNC119B cargo adapters: may help the release of UNC119 and UNC119B cargo or the recycling of UNC119 and UNC119B. May play a role in ciliary membrane localization via its interaction with UNC119B and protein transport into photoreceptor cells
C6orf62,Uncharacterized protein C6orf62; Chromosome 6 open reading frame 62
C8orf33,UPF0488 protein C8orf33; Chromosome 8 open reading frame 33; Belongs to the UPF0488 family
C9orf85,Uncharacterized protein C9orf85; Chromosome 9 open reading frame 85
CAMKV,CaM kinase-like vesicle-associated protein; Does not appear to have detectable kinase activity; Belongs to the protein kinase superfamily. CAMK Ser/Thr protein kinase family
CAPZA1,"F-actin-capping protein subunit alpha-1; F-actin-capping proteins bind in a Ca(2+)-independent manner to the fast growing ends of actin filaments (barbed end) thereby blocking the exchange of subunits at these ends. Unlike other capping proteins (such as gelsolin and severin), these proteins do not sever actin filaments. May play a role in the formation of epithelial cell junctions"
CASC5,"Kinetochore scaffold 1; Performs two crucial functions during mitosis: it is essential for spindle-assembly checkpoint signaling and for correct chromosome alignment. Required for attachment of the kinetochores to the spindle microtubules. Directly links BUB1 and BUB1B to kinetochores. Part of the MIS12 complex, which may be fundamental for kinetochore formation and proper chromosome segregation during mitosis. Acts in coordination with CENPK to recruit the NDC80 complex to the outer kinetochore"
CASP3,"Caspase-3; Involved in the activation cascade of caspases responsible for apoptosis execution. At the onset of apoptosis it proteolytically cleaves poly(ADP-ribose) polymerase (PARP) at a '216-Asp-|-Gly-217' bond. Cleaves and activates sterol regulatory element binding proteins (SREBPs) between the basic helix-loop- helix leucine zipper domain and the membrane attachment domain. Cleaves and activates caspase-6, -7 and -9. Involved in the cleavage of huntingtin. Triggers cell adhesion in sympathetic neurons through RET cleavage"
CASP8,"Caspase-8; Most upstream protease of the activation cascade of caspases responsible for the TNFRSF6/FAS mediated and TNFRSF1A induced cell death. Binding to the adapter molecule FADD recruits it to either receptor. The resulting aggregate called death- inducing signaling complex (DISC) performs CASP8 proteolytic activation. The active dimeric enzyme is then liberated from the DISC and free to activate downstream apoptotic proteases. Proteolytic fragments of the N-terminal propeptide (termed CAP3, CAP5 and CAP6) are likely retained in the DISC. Cleaves and activates CASP3, CASP4, CASP6, [...] "
CBX1,"Chromobox protein homolog 1; Component of heterochromatin. Recognizes and binds histone H3 tails methylated at 'Lys-9', leading to epigenetic repression. Interaction with lamin B receptor (LBR) can contribute to the association of the heterochromatin with the inner nuclear membrane; Chromobox family"
CBX2,"Chromobox protein homolog 2; Component of a Polycomb group (PcG) multiprotein PRC1- like complex, a complex class required to maintain the transcriptionally repressive state of many genes, including Hox genes, throughout development. PcG PRC1 complex acts via chromatin remodeling and modification of histones; it mediates monoubiquitination of histone H2A 'Lys-119', rendering chromatin heritably changed in its expressibility. Binds to histone H3 trimethylated at 'Lys-9' (H3K9me3) or at 'Lys-27' (H3K27me3) (By similarity). Plays a role in the lineage differentiation of the germ layers in [...] "
CBX3,"Chromobox protein homolog 3; Seems to be involved in transcriptional silencing in heterochromatin-like complexes. Recognizes and binds histone H3 tails methylated at 'Lys-9', leading to epigenetic repression. May contribute to the association of the heterochromatin with the inner nuclear membrane through its interaction with lamin B receptor (LBR). Involved in the formation of functional kinetochore through interaction with MIS12 complex proteins. Contributes to the conversion of local chromatin to a heterochromatin-like repressive state through H3 'Lys-9' trimethylation, mediates the  [...] "
CBX8,"Chromobox protein homolog 8; Component of a Polycomb group (PcG) multiprotein PRC1- like complex, a complex class required to maintain the transcriptionally repressive state of many genes, including Hox genes, throughout development. PcG PRC1 complex acts via chromatin remodeling and modification of histones; it mediates monoubiquitination of histone H2A 'Lys-119', rendering chromatin heritably changed in its expressibility; Chromobox family"
CCDC160,Coiled-coil domain containing 160; Belongs to the CCDC160 family
CCDC18,Coiled-coil domain containing 18
CCDC34,Coiled-coil domain containing 34
CCDC43,Coiled-coil domain containing 43; Belongs to the CCDC43 family
CCDC51,Coiled-coil domain containing 51
CCNA2,Cyclin-A2; Cyclin which controls both the G1/S and the G2/M transition phases of the cell cycle. Functions through the formation of specific serine/threonine protein kinase holoenzyme complexes with the cyclin-dependent protein kinases CDK1 or CDK2. The cyclin subunit confers the substrate specificity of these complexes and differentially interacts with and activates CDK1 and CDK2 throughout the cell cycle; Cyclins
CCNB1,G2/mitotic-specific cyclin-B1; Essential for the control of the cell cycle at the G2/M (mitosis) transition; Belongs to the cyclin family. Cyclin AB subfamily
CCNB2,G2/mitotic-specific cyclin-B2; Essential for the control of the cell cycle at the G2/M (mitosis) transition; Belongs to the cyclin family. Cyclin AB subfamily
CCNE1,G1/S-specific cyclin-E1; Essential for the control of the cell cycle at the G1/S (start) transition; Belongs to the cyclin family. Cyclin E subfamily
CCNE2,G1/S-specific cyclin-E2; Essential for the control of the cell cycle at the late G1 and early S phase; Belongs to the cyclin family. Cyclin E subfamily
CCNF,"Cyclin-F; Substrate recognition component of a SCF (SKP1-CUL1-F- box protein) E3 ubiquitin-protein ligase complex which mediates the ubiquitination and subsequent proteasomal degradation of CP110 during G2 phase, thereby acting as an inhibitor of centrosome reduplication; Belongs to the cyclin family. Cyclin AB subfamily"
CCT2,"T-complex protein 1 subunit beta; Molecular chaperone; assists the folding of proteins upon ATP hydrolysis. As part of the BBS/CCT complex may play a role in the assembly of BBSome, a complex involved in ciliogenesis regulating transports vesicles to the cilia. Known to play a role, in vitro, in the folding of actin and tubulin; Chaperonins"
CCT4,"T-complex protein 1 subunit delta; Molecular chaperone; assists the folding of proteins upon ATP hydrolysis. As part of the BBS/CCT complex may play a role in the assembly of BBSome, a complex involved in ciliogenesis regulating transports vesicles to the cilia. Known to play a role, in vitro, in the folding of actin and tubulin; Chaperonins"
CCT5,"T-complex protein 1 subunit epsilon; Molecular chaperone; assists the folding of proteins upon ATP hydrolysis. As part of the BBS/CCT complex may play a role in the assembly of BBSome, a complex involved in ciliogenesis regulating transports vesicles to the cilia. Known to play a role, in vitro, in the folding of actin and tubulin; Chaperonins"
CCT6A,"T-complex protein 1 subunit zeta; Molecular chaperone; assists the folding of proteins upon ATP hydrolysis. Known to play a role, in vitro, in the folding of actin and tubulin; Belongs to the TCP-1 chaperonin family"
CCT8,"T-complex protein 1 subunit theta; Molecular chaperone; assists the folding of proteins upon ATP hydrolysis. As part of the BBS/CCT complex may play a role in the assembly of BBSome, a complex involved in ciliogenesis regulating transports vesicles to the cilia. Known to play a role, in vitro, in the folding of actin and tubulin; Belongs to the TCP-1 chaperonin family"
CDC20,Cell division cycle protein 20 homolog; Required for full ubiquitin ligase activity of the anaphase promoting complex/cyclosome (APC/C) and may confer substrate specificity upon the complex. Is regulated by MAD2L1: in metaphase the MAD2L1-CDC20-APC/C ternary complex is inactive and in anaphase the CDC20-APC/C binary complex is active in degrading substrates. The CDC20-APC/C complex positively regulates the formation of synaptic vesicle clustering at active zone to the presynaptic membrane in postmitotic neurons. CDC20-APC/C-induced degradation of NEUROD2 induces presynaptic differentia [...] 
CDC25A,"M-phase inducer phosphatase 1; Tyrosine protein phosphatase which functions as a dosage-dependent inducer of mitotic progression. Directly dephosphorylates CDK1 and stimulates its kinase activity. Also dephosphorylates CDK2 in complex with cyclin E, in vitro; Class III Cys-based CDC25 phosphatases"
CDC25C,"M-phase inducer phosphatase 3; Functions as a dosage-dependent inducer in mitotic control. Tyrosine protein phosphatase required for progression of the cell cycle. When phosphorylated, highly effective in activating G2 cells into prophase. Directly dephosphorylates CDK1 and activates its kinase activity"
CDC45,Cell division control protein 45 homolog; Required for initiation of chromosomal DNA replication
CDC6,Cell division control protein 6 homolog; Involved in the initiation of DNA replication. Also participates in checkpoint controls that ensure DNA replication is completed before mitosis is initiated
CDC7,Cell division cycle 7-related protein kinase; Seems to phosphorylate critical substrates that regulate the G1/S phase transition and/or DNA replication. Can phosphorylates MCM2 and MCM3
